{
  "id": "rami",
  "specVersion": 1,
  "rulesVersion": 1,

  "name": { "fr": "Rami", "en": "Rummy" },
  "shortDescription": {
    "fr": "Le score le plus bas gagne. La partie s'arrête dès qu'un joueur atteint 251.",
    "en": "Lowest score wins. The game ends once a player reaches 251."
  },

  "symbol": "rectangle.stack.fill",
  "paletteID": "ambre",

  "players": { "min": 2, "max": 8, "recommended": [3, 4, 5] },

  "scoring": {
    "direction": "lowestWins",
    "aggregation": "cumulative",
    "roundLabel": { "fr": "Manche", "en": "Round" },
    "entry": {
      "kind": "integer",
      "min": 0,
      "max": 150,
      "allowsNegative": false
    },
    "modifiers": []
  },

  "engine": "generic.sum.v1",

  "end": {
    "conditions": [
      {
        "type": "scoreThreshold",
        "value": 251,
        "variantKey": "threshold",
        "comparison": ">=",
        "scope": "anyPlayer",
        "completeRound": true
      }
    ]
  },

  "tieBreak": ["shared"],

  "variants": [
    {
      "id": "threshold",
      "label": { "fr": "Fin de partie à", "en": "Game ends at" },
      "kind": "integerChoice",
      "values": [100, 251, 500],
      "default": 251
    }
  ],

  "statsProfiles": ["standard"]
}
