{
  "id": "skyjo",
  "specVersion": 1,
  "rulesVersion": 1,

  "name": { "fr": "Skyjo", "en": "Skyjo" },
  "shortDescription": {
    "fr": "Le score le plus bas gagne. La partie s'arrête dès qu'un joueur atteint 100.",
    "en": "Lowest score wins. The game ends once a player reaches 100."
  },

  "symbol": "square.grid.3x3.fill",
  "paletteID": "azur",

  "players": { "min": 2, "max": 8, "recommended": [3, 4, 5] },

  "scoring": {
    "direction": "lowestWins",
    "aggregation": "cumulative",
    "roundLabel": { "fr": "Manche", "en": "Round" },
    "entry": {
      "kind": "integer",
      "min": -24,
      "max": 156,
      "allowsNegative": true,
      "warnAbove": 90,
      "warnBelow": -12
    },
    "modifiers": [
      {
        "id": "closedRound",
        "label": { "fr": "A fermé la manche", "en": "Closed the round" },
        "kind": "exclusiveFlag",
        "required": true
      }
    ]
  },

  "engine": "skyjo.v1",

  "end": {
    "conditions": [
      {
        "type": "scoreThreshold",
        "value": 100,
        "variantKey": "threshold",
        "comparison": ">=",
        "scope": "anyPlayer",
        "completeRound": true
      }
    ]
  },

  "tieBreak": ["bestSingleRound", "fewestRoundsClosed", "shared"],

  "variants": [
    {
      "id": "threshold",
      "label": { "fr": "Fin de partie à", "en": "Game ends at" },
      "kind": "integerChoice",
      "values": [100, 150, 200],
      "default": 100
    },
    {
      "id": "doublePenalty",
      "label": { "fr": "Doublement du score", "en": "Score doubling" },
      "help": {
        "fr": "Le joueur qui ferme la manche voit son score doublé s'il n'a pas le score strictement le plus bas.",
        "en": "The player who closes the round has their score doubled unless it is strictly the lowest."
      },
      "kind": "bool",
      "default": true
    }
  ],

  "statsProfiles": ["standard", "skyjo"]
}
